{
  "schema_version": 1,
  "kind": "run",
  "run_id": "72cba698b93243808d83e6434e044606",
  "started_at": "2026-09-11T04:18:59.590300+00:00",
  "context": {
    "project": "/Users/alex/Projects/Fantasy Football",
    "cwd": "/Users/alex/Projects/Fantasy Football",
    "cwd_matches": true,
    "host": "MacBookPro.lan",
    "os": "macOS-26.6.2-arm64-arm-64bit-Mach-O",
    "python": "3.13.6",
    "executable": "/opt/homebrew/opt/python@3.13/bin/python3.13",
    "commit": "c88be0a2cd44550e0e690fe9b4e4620e77a31db7",
    "python_source_sha256": "ae1d478c14b66ac5dcac8943129740780ba84dc945d5601a93f2124ccf960d5b",
    "app_version": null,
    "account_workspace": null
  },
  "trigger_claim": "interactive",
  "task_id_claim": null,
  "expected_at_claim": null,
  "start_delay_seconds": null,
  "capabilities": {
    "local_command": {
      "status": "verified",
      "basis": "script_execution",
      "scope": "this process only; trigger is a caller claim"
    },
    "sleeper_read": {
      "status": "verified",
      "basis": "central_sleeper_client",
      "league_id": "1400628784381612032",
      "acquisition": {
        "cache_hit": false,
        "network_attempts": 1,
        "fetched_at": "2026-09-11T04:18:59.843431+00:00",
        "source_updated_at": null
      },
      "scope": "public league read only; not browser login or roster verification"
    },
    "scheduled_start": {
      "status": "untested",
      "basis": "none"
    },
    "browser_inspection": {
      "status": "untested",
      "basis": "none"
    },
    "task_inventory": {
      "status": "untested",
      "basis": "none"
    },
    "task_create": {
      "status": "untested",
      "basis": "none"
    },
    "task_update": {
      "status": "untested",
      "basis": "none"
    },
    "task_cancel": {
      "status": "untested",
      "basis": "none"
    },
    "one_off_timing": {
      "status": "untested",
      "basis": "none"
    },
    "timezone": {
      "status": "untested",
      "basis": "none"
    },
    "chat_closed": {
      "status": "untested",
      "basis": "none"
    },
    "app_restart": {
      "status": "untested",
      "basis": "none"
    },
    "notification_delivery": {
      "status": "untested",
      "basis": "none"
    }
  },
  "external_writes": false
}